{
  "schemaVersion": 1,
  "template": false,
  "agent": {
    "name": "ur-nexus",
    "version": "1.37.2",
    "commit": "2ee5abd244784aa12d9e32b9daf6fca8a3da8049"
  },
  "date": "2026-07-03T19:35:11.651Z",
  "benchmark": {
    "name": "local-smoke",
    "category": "internal-regression",
    "taskCount": 6
  },
  "runtime": {
    "provider": "local-regression",
    "model": "none",
    "environment": {
      "platform": "darwin",
      "arch": "arm64",
      "node": "v26.4.0",
      "bun": "1.3.14",
      "cwd": "/Users/maith/Desktop/ur3-dev/UR-1.37.2"
    }
  },
  "results": {
    "passed": 6,
    "failed": 0,
    "passRate": 1,
    "taskResults": [
      {
        "id": "simple-file-edit",
        "name": "simple file edit task",
        "category": "terminal-coding",
        "passed": true,
        "wallTimeMs": 36,
        "failureCategory": null
      },
      {
        "id": "failing-test-repair",
        "name": "failing test repair task",
        "category": "terminal-coding",
        "passed": true,
        "wallTimeMs": 94,
        "failureCategory": null
      },
      {
        "id": "provider-routing",
        "name": "provider routing task",
        "category": "provider-routing",
        "passed": true,
        "wallTimeMs": 171,
        "failureCategory": null
      },
      {
        "id": "sandbox-denial",
        "name": "sandbox denial task",
        "category": "sandbox-safety",
        "passed": true,
        "wallTimeMs": 472,
        "failureCategory": null
      },
      {
        "id": "tool-call-parsing",
        "name": "tool-call parsing task",
        "category": "tool-use",
        "passed": true,
        "wallTimeMs": 149,
        "failureCategory": null
      },
      {
        "id": "multi-step-coding",
        "name": "multi-step coding task",
        "category": "terminal-coding",
        "passed": true,
        "wallTimeMs": 6533,
        "failureCategory": null
      }
    ],
    "failedTasks": [],
    "failureCategories": {},
    "wallTimeMs": 7456,
    "tokenUsage": null,
    "costUSD": null
  },
  "reproduction": {
    "command": "bun run benchmark:smoke",
    "inputReport": null,
    "generatedBy": "scripts/benchmark-report.mjs"
  }
}
