{
  "schemaVersion": 1,
  "template": false,
  "agent": {
    "name": "ur-nexus",
    "version": "1.37.2",
    "commit": "2ee5abd244784aa12d9e32b9daf6fca8a3da8049"
  },
  "date": "2026-07-03T19:35:37.166Z",
  "benchmark": {
    "name": "local-regression",
    "category": "internal-regression",
    "taskCount": 20
  },
  "runtime": {
    "provider": "local-regression",
    "model": "none",
    "environment": {
      "platform": "darwin",
      "arch": "arm64",
      "node": "v26.4.0",
      "bun": "1.3.14",
      "cwd": "/Users/maith/Desktop/ur3-dev/UR-1.37.2"
    }
  },
  "results": {
    "passed": 20,
    "failed": 0,
    "passRate": 1,
    "taskResults": [
      {
        "id": "simple-file-edit",
        "name": "simple file edit task",
        "category": "terminal-coding",
        "passed": true,
        "wallTimeMs": 31,
        "failureCategory": null
      },
      {
        "id": "repo-edit-apply",
        "name": "repository edit apply task",
        "category": "terminal-coding",
        "passed": true,
        "wallTimeMs": 515,
        "failureCategory": null
      },
      {
        "id": "repo-edit-ast",
        "name": "repository AST edit task",
        "category": "terminal-coding",
        "passed": true,
        "wallTimeMs": 6571,
        "failureCategory": null
      },
      {
        "id": "repo-edit-imports",
        "name": "repository import edit task",
        "category": "terminal-coding",
        "passed": true,
        "wallTimeMs": 4426,
        "failureCategory": null
      },
      {
        "id": "repo-edit-move",
        "name": "repository move edit task",
        "category": "terminal-coding",
        "passed": true,
        "wallTimeMs": 6542,
        "failureCategory": null
      },
      {
        "id": "failing-test-repair",
        "name": "failing test repair task",
        "category": "terminal-coding",
        "passed": true,
        "wallTimeMs": 82,
        "failureCategory": null
      },
      {
        "id": "provider-routing",
        "name": "provider routing task",
        "category": "provider-routing",
        "passed": true,
        "wallTimeMs": 162,
        "failureCategory": null
      },
      {
        "id": "provider-reliability",
        "name": "provider reliability task",
        "category": "provider-routing",
        "passed": true,
        "wallTimeMs": 137,
        "failureCategory": null
      },
      {
        "id": "provider-streaming",
        "name": "provider streaming task",
        "category": "provider-routing",
        "passed": true,
        "wallTimeMs": 145,
        "failureCategory": null
      },
      {
        "id": "provider-tool-calls",
        "name": "provider tool-call task",
        "category": "tool-use",
        "passed": true,
        "wallTimeMs": 137,
        "failureCategory": null
      },
      {
        "id": "provider-multimodal",
        "name": "provider multimodal mapping task",
        "category": "provider-routing",
        "passed": true,
        "wallTimeMs": 138,
        "failureCategory": null
      },
      {
        "id": "sandbox-policy",
        "name": "sandbox denial task",
        "category": "sandbox-safety",
        "passed": true,
        "wallTimeMs": 457,
        "failureCategory": null
      },
      {
        "id": "safety-matrix",
        "name": "safety matrix proof task",
        "category": "sandbox-safety",
        "passed": true,
        "wallTimeMs": 83,
        "failureCategory": null
      },
      {
        "id": "sandbox-adapter",
        "name": "sandbox adapter task",
        "category": "sandbox-safety",
        "passed": true,
        "wallTimeMs": 432,
        "failureCategory": null
      },
      {
        "id": "sandbox-profile",
        "name": "sandbox profile task",
        "category": "sandbox-safety",
        "passed": true,
        "wallTimeMs": 37,
        "failureCategory": null
      },
      {
        "id": "release-hygiene",
        "name": "release hygiene task",
        "category": "internal-regression",
        "passed": true,
        "wallTimeMs": 26,
        "failureCategory": null
      },
      {
        "id": "benchmark-schema",
        "name": "benchmark schema validation task",
        "category": "internal-regression",
        "passed": true,
        "wallTimeMs": 199,
        "failureCategory": null
      },
      {
        "id": "eval-compare",
        "name": "eval comparison task",
        "category": "internal-regression",
        "passed": true,
        "wallTimeMs": 56,
        "failureCategory": null
      },
      {
        "id": "tool-call-parsing",
        "name": "tool-call parsing task",
        "category": "tool-use",
        "passed": true,
        "wallTimeMs": 28,
        "failureCategory": null
      },
      {
        "id": "multi-step-code-modification",
        "name": "multi-step code modification task",
        "category": "terminal-coding",
        "passed": true,
        "wallTimeMs": 954,
        "failureCategory": null
      }
    ],
    "failedTasks": [],
    "failureCategories": {},
    "wallTimeMs": 21160,
    "tokenUsage": null,
    "costUSD": null
  },
  "reproduction": {
    "command": "bun run benchmark:local",
    "inputReport": null,
    "generatedBy": "scripts/benchmark-report.mjs"
  }
}
